{
  "title": "Mage-OS Directory vendor trust file",
  "$schema": "https://json-schema.org/draft/2020-12/schema",
  "type": "object",
  "properties": {
    "$schema": {
      "type": "string"
    },
    "vendor": {
      "type": "string",
      "pattern": "^[a-z0-9]([_.-]?[a-z0-9]+)*$"
    },
    "vendorName": {
      "type": "string",
      "minLength": 1
    },
    "url": {
      "type": "string",
      "format": "uri"
    },
    "trustedVendor": {
      "default": false,
      "type": "boolean"
    },
    "partnerTier": {
      "default": null,
      "anyOf": [
        {
          "type": "string",
          "enum": [
            "platinum",
            "gold",
            "silver",
            "bronze"
          ]
        },
        {
          "type": "null"
        }
      ]
    },
    "packages": {
      "default": {},
      "type": "object",
      "propertyNames": {
        "type": "string",
        "pattern": "^[a-z0-9]([_.-]?[a-z0-9]+)*\\/[a-z0-9](([_.]|-{1,2})?[a-z0-9]+)*$"
      },
      "additionalProperties": {
        "type": "object",
        "properties": {
          "displayName": {
            "type": "string",
            "minLength": 1
          },
          "categories": {
            "minItems": 1,
            "type": "array",
            "items": {
              "type": "string",
              "pattern": "^[a-z0-9]+(-[a-z0-9]+)*$"
            }
          },
          "editorialPick": {
            "type": "boolean"
          },
          "warnings": {
            "type": "array",
            "items": {
              "type": "object",
              "properties": {
                "code": {
                  "type": "string",
                  "pattern": "^[a-z0-9]+(-[a-z0-9]+)*$"
                },
                "severity": {
                  "type": "string",
                  "enum": [
                    "info",
                    "derank",
                    "hide"
                  ]
                },
                "message": {
                  "type": "string",
                  "minLength": 10
                },
                "date": {
                  "type": "string",
                  "format": "date",
                  "pattern": "^(?:(?:\\d\\d[2468][048]|\\d\\d[13579][26]|\\d\\d0[48]|[02468][048]00|[13579][26]00)-02-29|\\d{4}-(?:(?:0[13578]|1[02])-(?:0[1-9]|[12]\\d|3[01])|(?:0[469]|11)-(?:0[1-9]|[12]\\d|30)|(?:02)-(?:0[1-9]|1\\d|2[0-8])))$"
                },
                "evidenceUrl": {
                  "type": "string",
                  "format": "uri"
                }
              },
              "required": [
                "code",
                "severity",
                "message",
                "date"
              ]
            }
          },
          "docsUrl": {
            "type": "string",
            "format": "uri"
          },
          "issuesUrl": {
            "type": "string",
            "format": "uri"
          }
        },
        "additionalProperties": false
      }
    }
  },
  "required": [
    "vendor",
    "vendorName"
  ],
  "additionalProperties": false
}
